{
    "$schema": "http://json-schema.org/draft-06/schema#",

    "definitions": {
        "courseCodeString": {
            "type": "string",
            "pattern": "^[A-Z]{4} [0-9]{3,4}$"
        },
        "arrayOfNonEmptyArrayOfCourseCodeStrings": {
            "type": "array",
            "items": {
                "type": "array",
                "minItems": 1,
                "items": { "$ref": "#/definitions/courseCodeString" }
            }
        },
        "alphaNumPunctString": {
            "type": "string",
            "pattern": "^[\\w ,.()-:;]+$"
        }
    },

    "title": "Course Info Schema",
    "description": "A set of courses offered at concordia with information about each one.",

    "type": "array",
    "uniqueItems": true,
    "minItems": 1,

    "items": {
        "type": "object",
        "properties": {
            "code": { "$ref": "#/definitions/courseCodeString" },
            "name": {"type": "string"},
            "credits": {"type": "string", "pattern": "^[0-9](\\.[0-9]{1,2})?$"},
            "description": {"type": "string"},
            "requirements": {
                "type": "object",
                "properties": {
                    "prereqs": { "$ref": "#/definitions/arrayOfNonEmptyArrayOfCourseCodeStrings" },
                    "coreqs": { "$ref": "#/definitions/arrayOfNonEmptyArrayOfCourseCodeStrings" }
                }

            },

            "lectureHours": {"type": "string"},
            "tutorialHours": {"type": "string"},
            "labHours": {"type": "string"},
            "note": {"type": "string"}
        },
        "required": ["code", "name", "credits", "description", "requirements"],
        "additionalProperties": false
    }
}
